{
  "$schema": "https://json-schema.org/draft/2020-12/schema",
  "$id": "keep-walking/art-manifest/1",
  "$comment": "Copied verbatim from art/direction/asset-pipeline.md 6.6 (art-director owns the source; change it there first). The root validates art/assets/manifest.json (artist-owned). $defs.buildManifest was added by tech-lead (P2-F06-T07) and validates art/assets/manifest.build.json, written only by tools/art. Rules JSON Schema cannot express are V1-V13 in tools/art/src/validate.ts.",
  "type": "object",
  "required": [
    "manifestVersion",
    "avatarRig",
    "updated",
    "baseDir",
    "assets"
  ],
  "additionalProperties": false,
  "properties": {
    "manifestVersion": {
      "const": 1
    },
    "avatarRig": {
      "const": 1
    },
    "updated": {
      "type": "string",
      "pattern": "^\\d{4}-\\d{2}-\\d{2}$"
    },
    "baseDir": {
      "const": "art/assets"
    },
    "assets": {
      "type": "array",
      "items": {
        "$ref": "#/$defs/entry"
      }
    }
  },
  "$defs": {
    "id": {
      "type": "string",
      "pattern": "^(icon|badge|frame|avatar|vfx|ui|illus|font|map|ref)\\.[a-z][a-z0-9]*(-[a-z0-9]+)*\\.[a-z][a-z0-9]*(-[a-z0-9]+)*$"
    },
    "date": {
      "type": "string",
      "pattern": "^\\d{4}-\\d{2}-\\d{2}$"
    },
    "entry": {
      "type": "object",
      "required": [
        "id",
        "kind",
        "status",
        "placeholder",
        "size",
        "files",
        "source",
        "license"
      ],
      "additionalProperties": false,
      "properties": {
        "id": {
          "$ref": "#/$defs/id"
        },
        "kind": {
          "enum": [
            "icon-ui",
            "icon-qc",
            "icon-item",
            "badge-class",
            "frame-rarity",
            "avatar-layer",
            "vfx",
            "ui",
            "illus",
            "font",
            "map-icon",
            "reference"
          ]
        },
        "status": {
          "enum": [
            "prompt-only",
            "placeholder",
            "draft",
            "approved",
            "deprecated"
          ]
        },
        "placeholder": {
          "type": "boolean"
        },
        "size": {
          "oneOf": [
            {
              "type": "null"
            },
            {
              "type": "object",
              "required": [
                "width",
                "height"
              ],
              "additionalProperties": false,
              "properties": {
                "width": {
                  "type": "integer",
                  "minimum": 1
                },
                "height": {
                  "type": "integer",
                  "minimum": 1
                }
              }
            }
          ]
        },
        "layer": {
          "enum": [
            "body",
            "face",
            "hair",
            "outfit_body",
            "outfit_feet",
            "weapon",
            "accessory_charm",
            "accessory_head",
            "accessory_face",
            "pose_hand",
            "pose_prop"
          ]
        },
        "sheet": {
          "type": "object",
          "required": [
            "frameW",
            "frameH",
            "cols",
            "rows"
          ],
          "additionalProperties": false,
          "properties": {
            "frameW": {
              "type": "integer"
            },
            "frameH": {
              "type": "integer"
            },
            "cols": {
              "type": "array",
              "items": {
                "type": "string"
              },
              "minItems": 1
            },
            "rows": {
              "type": "array",
              "items": {
                "type": "string"
              },
              "minItems": 1
            },
            "frames": {
              "type": "integer",
              "maximum": 12
            },
            "fps": {
              "type": "integer"
            }
          }
        },
        "variants": {
          "type": "object",
          "required": [
            "axis",
            "values"
          ],
          "additionalProperties": false,
          "properties": {
            "axis": {
              "enum": [
                "skin",
                "hair"
              ]
            },
            "values": {
              "type": "array",
              "items": {
                "type": "string",
                "pattern": "^(skin|hair)-[1-6]$"
              },
              "minItems": 1,
              "uniqueItems": true
            }
          }
        },
        "files": {
          "type": "array",
          "items": {
            "$ref": "#/$defs/file"
          }
        },
        "source": {
          "$ref": "#/$defs/source"
        },
        "license": {
          "$ref": "#/$defs/license"
        },
        "shipped": {
          "type": "boolean"
        },
        "review": {
          "type": "object",
          "required": [
            "gate",
            "verdict",
            "date"
          ],
          "properties": {
            "gate": {
              "type": "string"
            },
            "verdict": {
              "enum": [
                "PASS",
                "NEEDS_CHANGES"
              ]
            },
            "date": {
              "$ref": "#/$defs/date"
            }
          }
        },
        "replacedBy": {
          "$ref": "#/$defs/id"
        },
        "tags": {
          "type": "array",
          "items": {
            "type": "string"
          }
        },
        "notes": {
          "type": "string"
        }
      },
      "allOf": [
        {
          "if": {
            "properties": {
              "kind": {
                "const": "avatar-layer"
              }
            }
          },
          "then": {
            "required": [
              "layer"
            ]
          }
        },
        {
          "if": {
            "properties": {
              "status": {
                "enum": [
                  "prompt-only",
                  "placeholder"
                ]
              }
            }
          },
          "then": {
            "properties": {
              "placeholder": {
                "const": true
              }
            }
          },
          "else": {
            "properties": {
              "placeholder": {
                "const": false
              }
            }
          }
        },
        {
          "if": {
            "properties": {
              "status": {
                "not": {
                  "const": "prompt-only"
                }
              }
            }
          },
          "then": {
            "properties": {
              "files": {
                "minItems": 1
              }
            }
          }
        },
        {
          "if": {
            "properties": {
              "status": {
                "const": "approved"
              }
            }
          },
          "then": {
            "required": [
              "review"
            ],
            "properties": {
              "review": {
                "properties": {
                  "verdict": {
                    "const": "PASS"
                  }
                }
              }
            }
          }
        },
        {
          "if": {
            "properties": {
              "status": {
                "const": "deprecated"
              }
            }
          },
          "then": {
            "required": [
              "replacedBy"
            ]
          }
        }
      ]
    },
    "file": {
      "type": "object",
      "required": [
        "path",
        "format",
        "scale",
        "variant",
        "bytes",
        "width",
        "height"
      ],
      "additionalProperties": false,
      "properties": {
        "path": {
          "type": "string",
          "pattern": "^[a-z0-9@._/-]+$"
        },
        "format": {
          "enum": [
            "svg",
            "png",
            "webp",
            "woff2",
            "ttf"
          ]
        },
        "scale": {
          "enum": [
            1,
            2,
            null
          ]
        },
        "variant": {
          "type": [
            "string",
            "null"
          ]
        },
        "bytes": {
          "type": "integer",
          "minimum": 0
        },
        "width": {
          "type": [
            "integer",
            "null"
          ]
        },
        "height": {
          "type": [
            "integer",
            "null"
          ]
        },
        "sha256": {
          "type": [
            "string",
            "null"
          ],
          "pattern": "^[0-9a-f]{64}$"
        }
      }
    },
    "source": {
      "type": "object",
      "required": [
        "method",
        "author",
        "task",
        "master",
        "prompt",
        "tool",
        "origin",
        "date"
      ],
      "additionalProperties": false,
      "properties": {
        "method": {
          "enum": [
            "agent-svg",
            "build-generated",
            "prompt-raster",
            "agent-svg-from-ref",
            "vendor",
            "human-commission"
          ]
        },
        "author": {
          "type": "string"
        },
        "task": {
          "type": "string"
        },
        "master": {
          "type": [
            "string",
            "null"
          ]
        },
        "prompt": {
          "oneOf": [
            {
              "type": "null"
            },
            {
              "type": "object",
              "required": [
                "file",
                "anchor"
              ],
              "properties": {
                "file": {
                  "type": "string"
                },
                "anchor": {
                  "type": "string"
                }
              }
            }
          ]
        },
        "tool": {
          "oneOf": [
            {
              "type": "null"
            },
            {
              "type": "object",
              "required": [
                "name",
                "version"
              ],
              "properties": {
                "name": {
                  "type": "string"
                },
                "version": {
                  "type": "string"
                }
              }
            }
          ]
        },
        "origin": {
          "type": [
            "string",
            "null"
          ]
        },
        "date": {
          "type": "string"
        }
      }
    },
    "license": {
      "type": "object",
      "required": [
        "spdx",
        "holder",
        "file",
        "attribution",
        "reservedFontName",
        "modified"
      ],
      "additionalProperties": false,
      "properties": {
        "spdx": {
          "type": "string"
        },
        "holder": {
          "type": "string"
        },
        "file": {
          "type": [
            "string",
            "null"
          ]
        },
        "attribution": {
          "type": [
            "string",
            "null"
          ]
        },
        "reservedFontName": {
          "type": [
            "string",
            "null"
          ]
        },
        "modified": {
          "type": "boolean"
        }
      }
    },
    "sha256": {
      "type": "string",
      "pattern": "^[0-9a-f]{64}$"
    },
    "buildFile": {
      "type": "object",
      "required": [
        "path",
        "format",
        "scale",
        "variant",
        "bytes",
        "width",
        "height",
        "sha256"
      ],
      "additionalProperties": false,
      "properties": {
        "path": {
          "type": "string",
          "pattern": "^[a-z0-9@._/-]+$"
        },
        "format": {
          "const": "png"
        },
        "scale": {
          "enum": [
            1,
            2
          ]
        },
        "variant": {
          "type": [
            "string",
            "null"
          ]
        },
        "bytes": {
          "type": "integer",
          "minimum": 1
        },
        "width": {
          "type": "integer",
          "minimum": 1
        },
        "height": {
          "type": "integer",
          "minimum": 1
        },
        "sha256": {
          "$ref": "#/$defs/sha256"
        },
        "colors": {
          "type": "integer",
          "minimum": 1
        }
      }
    },
    "buildEntry": {
      "type": "object",
      "required": [
        "id",
        "master",
        "masterSha256",
        "files"
      ],
      "additionalProperties": false,
      "properties": {
        "id": {
          "$ref": "#/$defs/id"
        },
        "master": {
          "type": "string",
          "pattern": "^art/[a-z0-9@._/-]+\\.svg$"
        },
        "masterSha256": {
          "$ref": "#/$defs/sha256"
        },
        "files": {
          "type": "array",
          "minItems": 1,
          "items": {
            "$ref": "#/$defs/buildFile"
          }
        }
      }
    },
    "buildManifest": {
      "type": "object",
      "required": [
        "buildManifestVersion",
        "source",
        "tool",
        "platform",
        "assets"
      ],
      "additionalProperties": false,
      "properties": {
        "buildManifestVersion": {
          "const": 1
        },
        "source": {
          "const": "art/assets/manifest.json"
        },
        "tool": {
          "type": "object",
          "required": [
            "rasterizer",
            "quantizer"
          ],
          "additionalProperties": false,
          "properties": {
            "rasterizer": {
              "type": "object",
              "required": [
                "name",
                "version"
              ],
              "additionalProperties": false,
              "properties": {
                "name": {
                  "type": "string"
                },
                "version": {
                  "type": "string"
                }
              }
            },
            "quantizer": {
              "type": "object",
              "required": [
                "name",
                "version"
              ],
              "additionalProperties": false,
              "properties": {
                "name": {
                  "type": "string"
                },
                "version": {
                  "type": "string"
                }
              }
            }
          }
        },
        "platform": {
          "type": [
            "string",
            "null"
          ]
        },
        "assets": {
          "type": "array",
          "items": {
            "$ref": "#/$defs/buildEntry"
          }
        }
      }
    }
  }
}
